{
  "$schema": "https://json-schema.org/draft/2020-12/schema",
  "title": "Graph Studio document v3",
  "description": "Runtime validation also checks unique edge IDs and directed endpoint pairs, endpoint existence, and no self-loops. Sankey diagrams additionally require finite non-negative flow values, finite node totals. Cycles are supported as return flows.",
  "type": "object",
  "additionalProperties": false,
  "required": [
    "format",
    "version",
    "nodes",
    "edges"
  ],
  "properties": {
    "format": {
      "const": "graph-studio"
    },
    "version": {
      "const": 3
    },
    "diagram": {
      "enum": [
        "dag",
        "sankey"
      ],
      "description": "Optional diagram semantics. Defaults to dag. Sankey opens in flow layout."
    },
    "id": {
      "type": "string"
    },
    "title": {
      "type": "string"
    },
    "metadata": {
      "type": "object",
      "properties": {
        "timeline": {
          "type": "object",
          "description": "An optional view hint. Timeline preserves the v3 graph and its original edges.",
          "properties": {
            "timeZone": {
              "const": "UTC"
            },
            "asOf": {
              "$ref": "#/$defs/timelineDate"
            },
            "clock": {
              "type": "object",
              "required": [
                "mode"
              ],
              "properties": {
                "mode": {
                  "enum": [
                    "calendar",
                    "relative"
                  ]
                },
                "unit": {
                  "enum": [
                    "unit",
                    "second",
                    "minute",
                    "hour",
                    "day",
                    "week",
                    "cycle"
                  ]
                },
                "origin": {
                  "type": "string"
                },
                "format": {
                  "enum": [
                    "offset",
                    "elapsed"
                  ]
                },
                "precision": {
                  "type": "integer",
                  "minimum": 0,
                  "maximum": 12
                }
              },
              "additionalProperties": false
            }
          },
          "additionalProperties": false
        },
        "style": {
          "type": "string",
          "minLength": 1,
          "description": "Relative path to a graph-studio-style JSON file, resolved from this graph within the opened workspace. Appearance and layout settings belong in that file."
        }
      }
    },
    "nodes": {
      "type": "object",
      "propertyNames": {
        "$ref": "#/$defs/id"
      },
      "additionalProperties": {
        "$ref": "#/$defs/node"
      }
    },
    "edges": {
      "type": "array",
      "items": {
        "$ref": "#/$defs/edge"
      }
    },
    "hierarchy_edges": {
      "type": "array",
      "description": "Containment edges: source is the parent node and target is the child. Single parent per child; no cycles.",
      "items": {
        "type": "object",
        "additionalProperties": false,
        "required": [
          "id",
          "source",
          "target"
        ],
        "properties": {
          "id": {
            "type": "string",
            "minLength": 1
          },
          "source": {
            "type": "string",
            "minLength": 1
          },
          "target": {
            "type": "string",
            "minLength": 1
          }
        }
      }
    }
  },
  "allOf": [
    {
      "if": {
        "required": [
          "diagram"
        ],
        "properties": {
          "diagram": {
            "const": "sankey"
          }
        }
      },
      "then": {
        "properties": {
          "edges": {
            "items": {
              "required": [
                "value"
              ],
              "properties": {
                "value": {
                  "type": "number",
                  "minimum": 0
                }
              }
            }
          }
        }
      }
    }
  ],
  "$defs": {
    "id": {
      "type": "string",
      "minLength": 1,
      "pattern": "^(?!\\s)(?![\\s\\S]*\\s$)[^,\\r\\n]+$"
    },
    "node": {
      "type": "object",
      "properties": {
        "key": false,
        "parents": false,
        "children": false,
        "title": {
          "type": "string"
        },
        "define": {
          "type": "string"
        },
        "type": {
          "type": "string"
        },
        "time": {
          "$ref": "#/$defs/timelineTime"
        },
        "space": {
          "type": "integer",
          "minimum": 1,
          "maximum": 9007199254740991,
          "description": "One-based row index for horizontal timelines, column index for vertical timelines. Layout spacing determines the pixel distance; automatic layout never changes or compacts this index. Equal indices remain on the same row/column."
        },
        "track": {
          "type": "string",
          "description": "Optional timeline track. Overlapping events may use adjacent subtracks."
        },
        "status": {
          "type": "string",
          "description": "Optional event status stored as node data."
        }
      },
      "additionalProperties": true
    },
    "edge": {
      "type": "object",
      "additionalProperties": false,
      "required": [
        "id",
        "source",
        "target"
      ],
      "properties": {
        "id": {
          "$ref": "#/$defs/id"
        },
        "source": {
          "$ref": "#/$defs/id"
        },
        "target": {
          "$ref": "#/$defs/id"
        },
        "value": {
          "type": [
            "string",
            "number",
            "boolean",
            "null"
          ]
        },
        "metadata": {
          "type": "object",
          "properties": {
            "timeline": {
              "type": "object",
              "properties": {
                "kind": {
                  "enum": [
                    "sequence",
                    "dependency",
                    "reference",
                    "rendezvous",
                    "part-of"
                  ],
                  "default": "reference"
                },
                "sourceAnchor": {
                  "enum": [
                    "start",
                    "end"
                  ]
                },
                "targetAnchor": {
                  "enum": [
                    "start",
                    "end"
                  ]
                },
                "sourceTime": {
                  "oneOf": [
                    {
                      "$ref": "#/$defs/timelineDate"
                    },
                    {
                      "type": "number"
                    }
                  ]
                },
                "targetTime": {
                  "oneOf": [
                    {
                      "$ref": "#/$defs/timelineDate"
                    },
                    {
                      "type": "number"
                    }
                  ]
                }
              },
              "additionalProperties": true
            }
          }
        }
      }
    },
    "timelineDate": {
      "type": "string",
      "description": "ISO year, year-month, calendar date or date-time with explicit timezone. BCE uses astronomical signed six-digit years: 221 BCE is -000220. Original precision is retained.",
      "pattern": "^(?!-000000)(?:[+-]\\d{6}|\\d{4})(?:-\\d{2}(?:-\\d{2}(?:T\\d{2}:\\d{2}(?::\\d{2}(?:\\.\\d{1,9})?)?(?:Z|[+-]\\d{2}:\\d{2}))?)?)?$"
    },
    "timelineTime": {
      "type": "object",
      "description": "Calendar strings or relative numeric coordinates in metadata.timeline.clock.unit. No calendar conversion for numeric values. An explicit null end is calendar-only.",
      "oneOf": [
        {
          "required": [
            "at"
          ],
          "properties": {
            "at": {
              "$ref": "#/$defs/timelineDate"
            },
            "start": false,
            "end": false,
            "basis": {
              "const": "calendar"
            }
          }
        },
        {
          "required": [
            "start",
            "end"
          ],
          "properties": {
            "at": false,
            "start": {
              "$ref": "#/$defs/timelineDate"
            },
            "end": {
              "anyOf": [
                {
                  "$ref": "#/$defs/timelineDate"
                },
                {
                  "type": "null"
                }
              ]
            },
            "basis": {
              "const": "calendar"
            }
          }
        },
        {
          "required": [
            "at"
          ],
          "properties": {
            "basis": {
              "const": "relative"
            },
            "at": {
              "type": "number"
            },
            "start": false,
            "end": false
          }
        },
        {
          "required": [
            "start",
            "end"
          ],
          "properties": {
            "basis": {
              "const": "relative"
            },
            "at": false,
            "start": {
              "type": "number"
            },
            "end": {
              "type": "number"
            }
          }
        }
      ]
    }
  }
}
